number,value,datetime_start,datetime_complete,duration,params_activation,params_batch_size,params_dropout,params_l2,params_learning_rate,params_n_layers,params_units_0,params_units_1,params_units_2,params_units_3,params_units_4,user_attrs_epochs_trained,user_attrs_train_auc_final,user_attrs_val_auc_best,system_attrs_tpe:relative_params:0,state
52,0.7859423160552979,2026-09-10 14:12:15.359053,2026-09-10 14:14:32.682088,0 days 00:02:17.323035,relu,1024,0.24810739255241768,1.9198108762786342e-05,0.00305510600980437,2,256,256,,,,9.0,0.7642731070518494,0.7859423160552979,"{""activation"": ""relu"", ""batch_size"": 1024, ""dropout"": 0.24810739255241768, ""l2"": 1.9198108762786342e-05, ""learning_rate"": 0.00305510600980437, ""n_layers"": 2, ""units_0"": 256, ""units_1"": 256}",COMPLETE
53,0.7823676466941833,2026-09-10 14:14:32.706399,2026-09-10 14:16:36.609547,0 days 00:02:03.903148,relu,1024,0.2265838262008228,2.7737317224558185e-05,0.0035282713177384453,2,256,256,,,,10.0,0.7644902467727661,0.7823676466941833,"{""activation"": ""relu"", ""batch_size"": 1024, ""dropout"": 0.2265838262008228, ""l2"": 2.7737317224558185e-05, ""learning_rate"": 0.0035282713177384453, ""n_layers"": 2, ""units_0"": 256, ""units_1"": 256}",COMPLETE
54,0.7821238040924072,2026-09-10 14:16:36.636065,2026-09-10 14:18:04.525580,0 days 00:01:27.889515,relu,1024,0.35850441614650297,2.6651667727531334e-05,0.00032192091108643113,2,128,256,,,,9.0,0.7481992840766907,0.7821238040924072,"{""activation"": ""relu"", ""batch_size"": 1024, ""dropout"": 0.35850441614650297, ""l2"": 2.6651667727531334e-05, ""learning_rate"": 0.00032192091108643113, ""n_layers"": 2, ""units_0"": 128, ""units_1"": 256}",COMPLETE
55,0.7812920808792114,2026-09-10 14:18:04.581870,2026-09-10 14:20:42.118547,0 days 00:02:37.536677,relu,1024,0.43643601608585103,2.2293157244359254e-06,0.0014412819946917075,2,256,256,,,,13.0,0.7642027139663696,0.7812920808792114,"{""activation"": ""relu"", ""batch_size"": 1024, ""dropout"": 0.43643601608585103, ""l2"": 2.2293157244359254e-06, ""learning_rate"": 0.0014412819946917075, ""n_layers"": 2, ""units_0"": 256, ""units_1"": 256}",COMPLETE
56,0.7815202474594116,2026-09-10 14:20:42.147956,2026-09-10 14:22:37.777234,0 days 00:01:55.629278,relu,1024,0.22722742961328052,3.584999949781077e-06,0.009035310302689373,3,256,256,256.0,,,6.0,0.7589268088340759,0.7815202474594116,"{""activation"": ""relu"", ""batch_size"": 1024, ""dropout"": 0.22722742961328052, ""l2"": 3.584999949781077e-06, ""learning_rate"": 0.009035310302689373, ""n_layers"": 3, ""units_0"": 256, ""units_1"": 256}",COMPLETE
57,0.7857251167297363,2026-09-10 14:22:37.805795,2026-09-10 14:25:06.852059,0 days 00:02:29.046264,relu,1024,0.2633042001848567,2.0756110307233775e-05,0.0013661789118394627,2,256,32,,,,19.0,0.769494354724884,0.7857251167297363,"{""activation"": ""relu"", ""batch_size"": 1024, ""dropout"": 0.2633042001848567, ""l2"": 2.0756110307233775e-05, ""learning_rate"": 0.0013661789118394627, ""n_layers"": 2, ""units_0"": 256, ""units_1"": 32}",COMPLETE
