number,value,datetime_start,datetime_complete,duration,params_activation,params_batch_size,params_dropout,params_l2,params_learning_rate,params_n_layers,params_units_0,params_units_1,params_units_2,params_units_3,params_units_4,user_attrs_epochs_trained,user_attrs_train_auc_final,user_attrs_val_auc_best,system_attrs_tpe:relative_params:0,state
0,0.7775559425354004,2026-09-10 03:39:57.626234,2026-09-10 03:51:36.758555,0 days 00:11:39.132321,elu,2048,0.20869579394348992,0.0004814630675144935,1.6545944805072328e-05,5,64,128,256.0,256.0,64.0,36.0,0.7215989232063293,0.7775559425354004,,COMPLETE
1,0.7848168015480042,2026-09-10 03:51:36.794208,2026-09-10 03:52:53.879732,0 days 00:01:17.085524,relu,2048,0.4369463916704811,4.302781566036206e-05,0.0009441840187384604,2,64,32,,,,18.0,0.7552047371864319,0.7848168015480042,,COMPLETE
2,0.7833209037780762,2026-09-10 03:52:53.908100,2026-09-10 03:54:16.253006,0 days 00:01:22.344906,leaky_relu,256,0.28624668410065857,0.0019020380841310992,0.00017963606539354426,2,32,64,,,,9.0,0.7462753653526306,0.7833209037780762,,COMPLETE
3,0.7821027040481567,2026-09-10 03:54:16.277418,2026-09-10 03:56:54.207725,0 days 00:02:37.930307,relu,256,0.22612612598509566,0.003875624468222902,0.0003277214660752898,4,64,256,32.0,128.0,,9.0,0.7492474317550659,0.7821027040481567,,COMPLETE
4,0.783008873462677,2026-09-10 03:56:54.231916,2026-09-10 03:58:51.652804,0 days 00:01:57.420888,relu,1024,0.23968322688744356,0.0002617064981077936,0.0007456398879354032,3,128,256,32.0,,,10.0,0.7550674676895142,0.783008873462677,,COMPLETE
5,0.7799681425094604,2026-09-10 03:58:51.676025,2026-09-10 04:01:15.035917,0 days 00:02:23.359892,elu,256,0.12083385504633913,5.086660401529172e-06,0.0015472062317497984,4,128,256,32.0,128.0,,7.0,0.7554835081100464,0.7799681425094604,,COMPLETE
6,0.7801089882850647,2026-09-10 04:01:15.063534,2026-09-10 04:09:24.420569,0 days 00:08:09.357035,elu,256,0.1452736679542841,0.003410078347828091,0.001812410536796925,5,128,32,128.0,256.0,256.0,16.0,0.7447358965873718,0.7801089882850647,,COMPLETE
7,,2026-09-10 04:09:24.460161,,,elu,256,0.42494437311773503,0.00018183790298692326,2.052581340964465e-05,2,32,64,,,,,,,,RUNNING
8,0.7780676484107971,2026-09-10 11:49:17.311837,2026-09-10 11:52:15.836156,0 days 00:02:58.524319,leaky_relu,256,0.16256469684889807,0.0008778100991070715,0.0030431933279283286,2,32,256,,,,13.0,0.7542951703071594,0.7780676484107971,,COMPLETE
9,0.7807779312133789,2026-09-10 11:52:15.876544,2026-09-10 11:58:35.088258,0 days 00:06:19.211714,relu,256,0.3892685606888219,0.0033177681546337316,8.005621292865662e-05,4,128,256,256.0,256.0,,13.0,0.7467256784439087,0.7807779312133789,,COMPLETE
10,0.7880495190620422,2026-09-10 11:58:35.119853,2026-09-10 12:00:07.221372,0 days 00:01:32.101519,relu,1024,0.34711605423693226,8.696637900392942e-06,0.0013543895703304,2,256,256,,,,7.0,0.7579948902130127,0.7880495190620422,,COMPLETE
11,0.776379406452179,2026-09-10 12:00:07.251166,2026-09-10 12:07:20.309728,0 days 00:07:13.058562,relu,2048,0.29511835449343077,1.6442259335654462e-05,6.782919932910544e-05,3,256,256,64.0,,,27.0,0.740323543548584,0.776379406452179,"{""activation"": ""relu"", ""batch_size"": 2048, ""dropout"": 0.29511835449343077, ""l2"": 1.6442259335654462e-05, ""learning_rate"": 6.782919932910544e-05, ""n_layers"": 3, ""units_0"": 256, ""units_1"": 256}",COMPLETE
12,0.775871992111206,2026-09-10 12:07:20.338651,2026-09-10 12:08:23.177172,0 days 00:01:02.838521,relu,2048,0.42724861998893576,0.00011991942751484186,0.006865551751362393,4,64,32,64.0,64.0,,9.0,0.7472795248031616,0.775871992111206,"{""activation"": ""relu"", ""batch_size"": 2048, ""dropout"": 0.42724861998893576, ""l2"": 0.00011991942751484186, ""learning_rate"": 0.006865551751362393, ""n_layers"": 4, ""units_0"": 64, ""units_1"": 32}",COMPLETE
13,0.7755201458930969,2026-09-10 12:08:23.207586,2026-09-10 12:11:37.007510,0 days 00:03:13.799924,relu,1024,0.40450122805380984,1.6200242029053883e-05,0.006579324705667472,3,256,256,128.0,,,11.0,0.760920524597168,0.7755201458930969,"{""activation"": ""relu"", ""batch_size"": 1024, ""dropout"": 0.40450122805380984, ""l2"": 1.6200242029053883e-05, ""learning_rate"": 0.006579324705667472, ""n_layers"": 3, ""units_0"": 256, ""units_1"": 256}",COMPLETE
14,0.7668496370315552,2026-09-10 12:11:37.045572,2026-09-10 12:12:44.388018,0 days 00:01:07.342446,relu,2048,0.4496553769893775,3.936040084141899e-05,0.00029421871425340475,4,64,32,256.0,32.0,,7.0,0.7144339084625244,0.7668496370315552,"{""activation"": ""relu"", ""batch_size"": 2048, ""dropout"": 0.4496553769893775, ""l2"": 3.936040084141899e-05, ""learning_rate"": 0.00029421871425340475, ""n_layers"": 4, ""units_0"": 64, ""units_1"": 32}",COMPLETE
15,0.7819950580596924,2026-09-10 12:12:44.416002,2026-09-10 12:13:34.347229,0 days 00:00:49.931227,elu,2048,0.4099151108180193,6.867339996089856e-06,0.002138378477668013,2,64,32,,,,13.0,0.7526077628135681,0.7819950580596924,"{""activation"": ""elu"", ""batch_size"": 2048, ""dropout"": 0.4099151108180193, ""l2"": 6.867339996089856e-06, ""learning_rate"": 0.002138378477668013, ""n_layers"": 2, ""units_0"": 64, ""units_1"": 32}",COMPLETE
16,0.7804355621337891,2026-09-10 12:13:34.371729,2026-09-10 12:15:02.170264,0 days 00:01:27.798535,relu,2048,0.3705177688686737,0.0007676996851809019,0.0003018903176078934,3,64,32,64.0,,,18.0,0.7430420517921448,0.7804355621337891,"{""activation"": ""relu"", ""batch_size"": 2048, ""dropout"": 0.3705177688686737, ""l2"": 0.0007676996851809019, ""learning_rate"": 0.0003018903176078934, ""n_layers"": 3, ""units_0"": 64, ""units_1"": 32}",COMPLETE
17,0.7811441421508789,2026-09-10 12:15:02.205138,2026-09-10 12:17:54.615145,0 days 00:02:52.410007,relu,1024,0.4030750987099568,1.457458001317695e-06,0.000283438354662801,2,256,256,,,,12.0,0.7524707913398743,0.7811441421508789,"{""activation"": ""relu"", ""batch_size"": 1024, ""dropout"": 0.4030750987099568, ""l2"": 1.457458001317695e-06, ""learning_rate"": 0.000283438354662801, ""n_layers"": 2, ""units_0"": 256, ""units_1"": 256}",COMPLETE
18,0.7838717699050903,2026-09-10 12:17:54.642079,2026-09-10 12:19:57.782730,0 days 00:02:03.140651,relu,1024,0.3411045600114502,6.865740528285375e-06,0.000750753107375215,3,256,128,128.0,,,10.0,0.7566244602203369,0.7838717699050903,"{""activation"": ""relu"", ""batch_size"": 1024, ""dropout"": 0.3411045600114502, ""l2"": 6.865740528285375e-06, ""learning_rate"": 0.000750753107375215, ""n_layers"": 3, ""units_0"": 256, ""units_1"": 128}",COMPLETE
19,0.7796682119369507,2026-09-10 12:19:57.808460,2026-09-10 12:20:35.046683,0 days 00:00:37.238223,relu,2048,0.4870889851742052,3.369263470878915e-06,0.0017143866553030972,2,64,32,,,,8.0,0.7468981146812439,0.7796682119369507,"{""activation"": ""relu"", ""batch_size"": 2048, ""dropout"": 0.4870889851742052, ""l2"": 3.369263470878915e-06, ""learning_rate"": 0.0017143866553030972, ""n_layers"": 2, ""units_0"": 64, ""units_1"": 32}",COMPLETE
20,0.7765697240829468,2026-09-10 12:20:35.075113,2026-09-10 12:21:52.803705,0 days 00:01:17.728592,relu,1024,0.36775949738900326,2.7891942045435272e-05,0.00013637203647490058,2,64,32,,,,15.0,0.7368517518043518,0.7765697240829468,"{""activation"": ""relu"", ""batch_size"": 1024, ""dropout"": 0.36775949738900326, ""l2"": 2.7891942045435272e-05, ""learning_rate"": 0.00013637203647490058, ""n_layers"": 2, ""units_0"": 64, ""units_1"": 32}",COMPLETE
21,0.7778540253639221,2026-09-10 12:21:52.835387,2026-09-10 12:22:59.875209,0 days 00:01:07.039822,relu,1024,0.3233373934405073,4.266927994553701e-05,0.005366209593719857,3,64,64,64.0,,,11.0,0.7587489485740662,0.7778540253639221,"{""activation"": ""relu"", ""batch_size"": 1024, ""dropout"": 0.3233373934405073, ""l2"": 4.266927994553701e-05, ""learning_rate"": 0.005366209593719857, ""n_layers"": 3, ""units_0"": 64, ""units_1"": 64}",COMPLETE
22,0.7821786403656006,2026-09-10 12:22:59.905297,2026-09-10 12:27:31.023840,0 days 00:04:31.118543,relu,1024,0.3477537232538951,2.1453387496565745e-06,0.0009274540285247635,4,256,128,128.0,32.0,,19.0,0.7611018419265747,0.7821786403656006,"{""activation"": ""relu"", ""batch_size"": 1024, ""dropout"": 0.3477537232538951, ""l2"": 2.1453387496565745e-06, ""learning_rate"": 0.0009274540285247635, ""n_layers"": 4, ""units_0"": 256, ""units_1"": 128}",COMPLETE
23,0.7856655120849609,2026-09-10 12:27:31.051355,2026-09-10 12:34:21.334503,0 days 00:06:50.283148,relu,1024,0.4805545343314319,0.00014650618297823854,0.00029334676824245044,3,256,256,128.0,,,25.0,0.7555713057518005,0.7856655120849609,"{""activation"": ""relu"", ""batch_size"": 1024, ""dropout"": 0.4805545343314319, ""l2"": 0.00014650618297823854, ""learning_rate"": 0.00029334676824245044, ""n_layers"": 3, ""units_0"": 256, ""units_1"": 256}",COMPLETE
24,0.7802228927612305,2026-09-10 12:34:21.366239,2026-09-10 12:36:53.801825,0 days 00:02:32.435586,relu,1024,0.4925465303264811,0.000441554050469142,0.0005478040615780017,3,32,256,128.0,,,13.0,0.7462139129638672,0.7802228927612305,"{""activation"": ""relu"", ""batch_size"": 1024, ""dropout"": 0.4925465303264811, ""l2"": 0.000441554050469142, ""learning_rate"": 0.0005478040615780017, ""n_layers"": 3, ""units_0"": 32, ""units_1"": 256}",COMPLETE
25,0.782875657081604,2026-09-10 12:36:53.830446,2026-09-10 12:41:13.720955,0 days 00:04:19.890509,relu,1024,0.44751980702055405,0.000164356469747631,0.0007358845741890316,4,256,256,128.0,64.0,,15.0,0.7546179294586182,0.782875657081604,"{""activation"": ""relu"", ""batch_size"": 1024, ""dropout"": 0.44751980702055405, ""l2"": 0.000164356469747631, ""learning_rate"": 0.0007358845741890316, ""n_layers"": 4, ""units_0"": 256, ""units_1"": 256}",COMPLETE
26,0.7850161194801331,2026-09-10 12:41:13.748337,2026-09-10 12:46:08.411256,0 days 00:04:54.662919,relu,1024,0.4416531700792343,9.157220169463765e-06,0.0008953934554525114,3,256,256,128.0,,,18.0,0.7601500749588013,0.7850161194801331,"{""activation"": ""relu"", ""batch_size"": 1024, ""dropout"": 0.4416531700792343, ""l2"": 9.157220169463765e-06, ""learning_rate"": 0.0008953934554525114, ""n_layers"": 3, ""units_0"": 256, ""units_1"": 256}",COMPLETE
27,0.7810488939285278,2026-09-10 12:46:08.450409,2026-09-10 12:53:52.660909,0 days 00:07:44.210500,relu,1024,0.4101845758282991,2.5238881685168713e-05,0.0001438989459773807,3,256,256,128.0,,,26.0,0.7526151537895203,0.7810488939285278,"{""activation"": ""relu"", ""batch_size"": 1024, ""dropout"": 0.4101845758282991, ""l2"": 2.5238881685168713e-05, ""learning_rate"": 0.0001438989459773807, ""n_layers"": 3, ""units_0"": 256, ""units_1"": 256}",COMPLETE
28,0.7802951335906982,2026-09-10 12:53:52.687256,2026-09-10 13:02:19.670557,0 days 00:08:26.983301,relu,1024,0.4406095209651085,0.000128468166429672,6.345915406218197e-05,2,256,256,,,,34.0,0.746149480342865,0.7802951335906982,"{""activation"": ""relu"", ""batch_size"": 1024, ""dropout"": 0.4406095209651085, ""l2"": 0.000128468166429672, ""learning_rate"": 6.345915406218197e-05, ""n_layers"": 2, ""units_0"": 256, ""units_1"": 256}",COMPLETE
29,0.7791976928710938,2026-09-10 13:02:19.709461,2026-09-10 13:04:26.981665,0 days 00:02:07.272204,relu,1024,0.44573730934476924,1.1023854277966352e-05,0.0009145904905287219,2,256,256,,,,7.0,0.7535685300827026,0.7791976928710938,"{""activation"": ""relu"", ""batch_size"": 1024, ""dropout"": 0.44573730934476924, ""l2"": 1.1023854277966352e-05, ""learning_rate"": 0.0009145904905287219, ""n_layers"": 2, ""units_0"": 256, ""units_1"": 256}",COMPLETE
30,0.7804210782051086,2026-09-10 13:04:27.019242,2026-09-10 13:05:21.177679,0 days 00:00:54.158437,relu,1024,0.2938758010119901,2.7620247206526587e-06,0.00304304487071815,2,64,256,,,,6.0,0.7565165162086487,0.7804210782051086,"{""activation"": ""relu"", ""batch_size"": 1024, ""dropout"": 0.2938758010119901, ""l2"": 2.7620247206526587e-06, ""learning_rate"": 0.00304304487071815, ""n_layers"": 2, ""units_0"": 64, ""units_1"": 256}",COMPLETE
31,0.7812058925628662,2026-09-10 13:05:21.211503,2026-09-10 13:11:49.224134,0 days 00:06:28.012631,relu,1024,0.43682806112334654,0.0001755296588916362,0.0001453639068403773,4,256,256,128.0,128.0,,21.0,0.7420525550842285,0.7812058925628662,"{""activation"": ""relu"", ""batch_size"": 1024, ""dropout"": 0.43682806112334654, ""l2"": 0.0001755296588916362, ""learning_rate"": 0.0001453639068403773, ""n_layers"": 4, ""units_0"": 256, ""units_1"": 256}",COMPLETE
32,0.7833817005157471,2026-09-10 13:11:49.253154,2026-09-10 13:14:46.337909,0 days 00:02:57.084755,relu,1024,0.48326777218157735,3.2009333568192814e-05,0.0004012344355258974,3,256,256,128.0,,,11.0,0.7475886940956116,0.7833817005157471,"{""activation"": ""relu"", ""batch_size"": 1024, ""dropout"": 0.48326777218157735, ""l2"": 3.2009333568192814e-05, ""learning_rate"": 0.0004012344355258974, ""n_layers"": 3, ""units_0"": 256, ""units_1"": 256}",COMPLETE
33,0.782918393611908,2026-09-10 13:14:46.372485,2026-09-10 13:20:00.468156,0 days 00:05:14.095671,relu,1024,0.48274763722362035,3.4832211845190585e-06,0.0003649828109641194,3,256,256,128.0,,,19.0,0.7539418339729309,0.782918393611908,"{""activation"": ""relu"", ""batch_size"": 1024, ""dropout"": 0.48274763722362035, ""l2"": 3.4832211845190585e-06, ""learning_rate"": 0.0003649828109641194, ""n_layers"": 3, ""units_0"": 256, ""units_1"": 256}",COMPLETE
34,0.7843626737594604,2026-09-10 13:20:00.498031,2026-09-10 13:24:17.449687,0 days 00:04:16.951656,relu,1024,0.3647006490981503,6.054408024056939e-05,0.0009081762362336726,3,256,256,32.0,,,17.0,0.7604849338531494,0.7843626737594604,"{""activation"": ""relu"", ""batch_size"": 1024, ""dropout"": 0.3647006490981503, ""l2"": 6.054408024056939e-05, ""learning_rate"": 0.0009081762362336726, ""n_layers"": 3, ""units_0"": 256, ""units_1"": 256}",COMPLETE
35,0.7814869284629822,2026-09-10 13:24:17.482156,2026-09-10 13:25:30.037523,0 days 00:01:12.555367,relu,1024,0.48415280652075027,3.9447205469149985e-05,0.004395566311791377,3,256,64,256.0,,,6.0,0.7515479326248169,0.7814869284629822,"{""activation"": ""relu"", ""batch_size"": 1024, ""dropout"": 0.48415280652075027, ""l2"": 3.9447205469149985e-05, ""learning_rate"": 0.004395566311791377, ""n_layers"": 3, ""units_0"": 256, ""units_1"": 64}",COMPLETE
36,0.7810017466545105,2026-09-10 13:25:30.063256,2026-09-10 13:26:03.711187,0 days 00:00:33.647931,relu,1024,0.43571642655418374,3.900569518109481e-05,0.0025493252006010647,2,64,32,,,,7.0,0.7513260841369629,0.7810017466545105,"{""activation"": ""relu"", ""batch_size"": 1024, ""dropout"": 0.43571642655418374, ""l2"": 3.900569518109481e-05, ""learning_rate"": 0.0025493252006010647, ""n_layers"": 2, ""units_0"": 64, ""units_1"": 32}",COMPLETE
37,0.7792110443115234,2026-09-10 13:26:03.738190,2026-09-10 13:27:12.135734,0 days 00:01:08.397544,relu,2048,0.44791078902485393,3.869679754034838e-05,0.0005720737892155734,2,64,32,,,,16.0,0.7471680045127869,0.7792110443115234,"{""activation"": ""relu"", ""batch_size"": 2048, ""dropout"": 0.44791078902485393, ""l2"": 3.869679754034838e-05, ""learning_rate"": 0.0005720737892155734, ""n_layers"": 2, ""units_0"": 64, ""units_1"": 32}",COMPLETE
38,0.7856667637825012,2026-09-10 13:27:12.162688,2026-09-10 13:31:07.032915,0 days 00:03:54.870227,relu,1024,0.32824078941989376,1.6830110423341027e-05,0.0012811424937100807,2,256,256,,,,17.0,0.7694529294967651,0.7856667637825012,"{""activation"": ""relu"", ""batch_size"": 1024, ""dropout"": 0.32824078941989376, ""l2"": 1.6830110423341027e-05, ""learning_rate"": 0.0012811424937100807, ""n_layers"": 2, ""units_0"": 256, ""units_1"": 256}",COMPLETE
39,0.7856323719024658,2026-09-10 13:31:07.064727,2026-09-10 13:35:14.250506,0 days 00:04:07.185779,relu,1024,0.3033319241356492,5.9915282565398595e-05,0.0017973781026860945,2,256,256,,,,16.0,0.769248902797699,0.7856323719024658,"{""activation"": ""relu"", ""batch_size"": 1024, ""dropout"": 0.3033319241356492, ""l2"": 5.9915282565398595e-05, ""learning_rate"": 0.0017973781026860945, ""n_layers"": 2, ""units_0"": 256, ""units_1"": 256}",COMPLETE
40,0.7871415615081787,2026-09-10 13:35:14.294938,2026-09-10 13:38:27.696150,0 days 00:03:13.401212,relu,1024,0.3018684009315346,0.00013953086251405482,0.0008994748843464354,2,256,256,,,,15.0,0.7632648944854736,0.7871415615081787,"{""activation"": ""relu"", ""batch_size"": 1024, ""dropout"": 0.3018684009315346, ""l2"": 0.00013953086251405482, ""learning_rate"": 0.0008994748843464354, ""n_layers"": 2, ""units_0"": 256, ""units_1"": 256}",COMPLETE
41,0.7826032638549805,2026-09-10 13:38:27.731104,2026-09-10 13:40:58.115586,0 days 00:02:30.384482,relu,1024,0.2552461829152961,0.00017268420800375893,0.0005649519638490844,2,256,256,,,,13.0,0.7605953216552734,0.7826032638549805,"{""activation"": ""relu"", ""batch_size"": 1024, ""dropout"": 0.2552461829152961, ""l2"": 0.00017268420800375893, ""learning_rate"": 0.0005649519638490844, ""n_layers"": 2, ""units_0"": 256, ""units_1"": 256}",COMPLETE
42,0.7848597168922424,2026-09-10 13:40:58.142179,2026-09-10 13:43:26.039351,0 days 00:02:27.897172,relu,1024,0.2872838192750088,0.0001356404088816946,0.002973067590242212,3,256,256,32.0,,,11.0,0.7591251730918884,0.7848597168922424,"{""activation"": ""relu"", ""batch_size"": 1024, ""dropout"": 0.2872838192750088, ""l2"": 0.0001356404088816946, ""learning_rate"": 0.002973067590242212, ""n_layers"": 3, ""units_0"": 256, ""units_1"": 256}",COMPLETE
43,0.7866773009300232,2026-09-10 13:43:26.074156,2026-09-10 13:47:14.917265,0 days 00:03:48.843109,relu,1024,0.2919303373162528,3.24592348477936e-05,0.00035173420740424116,2,256,256,,,,16.0,0.7604029178619385,0.7866773009300232,"{""activation"": ""relu"", ""batch_size"": 1024, ""dropout"": 0.2919303373162528, ""l2"": 3.24592348477936e-05, ""learning_rate"": 0.00035173420740424116, ""n_layers"": 2, ""units_0"": 256, ""units_1"": 256}",COMPLETE
44,0.7846871614456177,2026-09-10 13:47:14.944672,2026-09-10 13:51:11.383434,0 days 00:03:56.438762,relu,1024,0.28523280844773097,1.634234166318327e-05,0.0003977699594989751,2,256,256,,,,18.0,0.7642549276351929,0.7846871614456177,"{""activation"": ""relu"", ""batch_size"": 1024, ""dropout"": 0.28523280844773097, ""l2"": 1.634234166318327e-05, ""learning_rate"": 0.0003977699594989751, ""n_layers"": 2, ""units_0"": 256, ""units_1"": 256}",COMPLETE
45,0.7827633023262024,2026-09-10 13:51:11.419025,2026-09-10 13:55:14.566008,0 days 00:04:03.146983,relu,1024,0.2940512512766551,0.0003366417289764582,0.00027640231226753006,2,256,256,,,,17.0,0.7578389048576355,0.7827633023262024,"{""activation"": ""relu"", ""batch_size"": 1024, ""dropout"": 0.2940512512766551, ""l2"": 0.0003366417289764582, ""learning_rate"": 0.00027640231226753006, ""n_layers"": 2, ""units_0"": 256, ""units_1"": 256}",COMPLETE
46,0.7851012349128723,2026-09-10 13:55:14.595130,2026-09-10 13:57:17.448219,0 days 00:02:02.853089,relu,1024,0.27197769453333653,0.0005426727891889619,0.003034206128094583,2,256,256,,,,8.0,0.7530577182769775,0.7851012349128723,"{""activation"": ""relu"", ""batch_size"": 1024, ""dropout"": 0.27197769453333653, ""l2"": 0.0005426727891889619, ""learning_rate"": 0.003034206128094583, ""n_layers"": 2, ""units_0"": 256, ""units_1"": 256}",COMPLETE
47,0.7824156284332275,2026-09-10 13:57:17.473459,2026-09-10 14:00:14.033529,0 days 00:02:56.560070,relu,1024,0.3448673748039665,2.474771716623386e-06,0.0009237482004829865,2,256,256,,,,13.0,0.7633815407752991,0.7824156284332275,"{""activation"": ""relu"", ""batch_size"": 1024, ""dropout"": 0.3448673748039665, ""l2"": 2.474771716623386e-06, ""learning_rate"": 0.0009237482004829865, ""n_layers"": 2, ""units_0"": 256, ""units_1"": 256}",COMPLETE
48,0.7836833000183105,2026-09-10 14:00:14.069913,2026-09-10 14:02:22.497123,0 days 00:02:08.427210,relu,1024,0.29153310048827413,1.064341871310391e-05,0.002703411145896091,2,256,256,,,,10.0,0.7640085816383362,0.7836833000183105,"{""activation"": ""relu"", ""batch_size"": 1024, ""dropout"": 0.29153310048827413, ""l2"": 1.064341871310391e-05, ""learning_rate"": 0.002703411145896091, ""n_layers"": 2, ""units_0"": 256, ""units_1"": 256}",COMPLETE
49,0.7817038297653198,2026-09-10 14:02:22.523362,2026-09-10 14:04:13.944514,0 days 00:01:51.421152,relu,1024,0.37349434139596766,5.00285423839955e-06,0.004474224359975459,2,256,256,,,,8.0,0.7624742388725281,0.7817038297653198,"{""activation"": ""relu"", ""batch_size"": 1024, ""dropout"": 0.37349434139596766, ""l2"": 5.00285423839955e-06, ""learning_rate"": 0.004474224359975459, ""n_layers"": 2, ""units_0"": 256, ""units_1"": 256}",COMPLETE
50,0.7791996002197266,2026-09-10 14:04:13.971363,2026-09-10 14:06:37.375127,0 days 00:02:23.403764,relu,1024,0.2471895609244188,5.838226744306943e-05,0.001158624729774181,3,256,256,256.0,,,8.0,0.7584265470504761,0.7791996002197266,"{""activation"": ""relu"", ""batch_size"": 1024, ""dropout"": 0.2471895609244188, ""l2"": 5.838226744306943e-05, ""learning_rate"": 0.001158624729774181, ""n_layers"": 3, ""units_0"": 256, ""units_1"": 256}",COMPLETE
51,0.783056378364563,2026-09-10 14:06:37.399959,2026-09-10 14:12:15.325351,0 days 00:05:37.925392,relu,1024,0.24708278608300144,7.224865886079798e-05,0.00012306456654630863,3,256,256,64.0,,,23.0,0.7544899582862854,0.783056378364563,"{""activation"": ""relu"", ""batch_size"": 1024, ""dropout"": 0.24708278608300144, ""l2"": 7.224865886079798e-05, ""learning_rate"": 0.00012306456654630863, ""n_layers"": 3, ""units_0"": 256, ""units_1"": 256}",COMPLETE
